{
  "$schema": "https://json-schema.org/draft/2020-12/schema",
  "$id": "urn:aibridge:contracts:v1:bridge-config",
  "title": "BridgeConfig",
  "description": "@generated by scripts/generate-contracts.ts from src/config/schemas.ts:43 (export bridgeConfigSchema). DO NOT EDIT. Invariants from .refine()/.superRefine() are NOT representable in JSON Schema and are absent from this file; they remain enforced by the TypeScript engine, which is the sole authority for them (ADR 0008 §2.2 Tier 2).",
  "type": "object",
  "properties": {
    "agent_id": {
      "type": "string",
      "minLength": 1,
      "title": "BridgeConfigAgentId"
    },
    "bridge": {
      "type": "object",
      "properties": {
        "host": {
          "type": "string",
          "minLength": 1,
          "title": "BridgeConfigBridgeHost"
        },
        "port": {
          "type": "integer",
          "exclusiveMinimum": 0,
          "maximum": 9007199254740991,
          "title": "BridgeConfigBridgePort"
        },
        "public_url": {
          "type": "string",
          "format": "uri",
          "title": "BridgeConfigBridgePublicUrl"
        },
        "ingress_mode": {
          "default": "engine",
          "type": "string",
          "enum": [
            "engine",
            "router"
          ],
          "title": "BridgeConfigBridgeIngressMode"
        }
      },
      "required": [
        "host",
        "port",
        "public_url"
      ],
      "additionalProperties": false
    },
    "opencode": {
      "type": "object",
      "properties": {
        "base_url": {
          "type": "string",
          "format": "uri",
          "title": "BridgeConfigOpencodeBaseUrl"
        },
        "server_port": {
          "type": "integer",
          "exclusiveMinimum": 0,
          "maximum": 9007199254740991,
          "title": "BridgeConfigOpencodeServerPort"
        },
        "username": {
          "default": "opencode",
          "type": "string"
        },
        "password_env": {
          "default": "OPENCODE_SERVER_PASSWORD",
          "type": "string"
        }
      },
      "required": [
        "base_url",
        "server_port"
      ],
      "additionalProperties": false
    },
    "security": {
      "type": "object",
      "properties": {
        "auth_mode": {
          "default": "bearer-token",
          "type": "string",
          "enum": [
            "bearer-token",
            "none"
          ],
          "title": "BridgeConfigSecurityAuthMode"
        },
        "allowed_sources": {
          "type": "array",
          "items": {
            "type": "object",
            "properties": {
              "source_agent_id": {
                "type": "string",
                "minLength": 1,
                "title": "BridgeConfigSecurityAllowedSourcesSourceAgentId"
              },
              "capabilities": {
                "type": "array",
                "items": {
                  "type": "string",
                  "minLength": 1,
                  "title": "BridgeConfigSecurityAllowedSourcesCapabilities"
                }
              },
              "requires_plan_approval": {
                "default": [],
                "type": "array",
                "items": {
                  "type": "string",
                  "minLength": 1,
                  "title": "BridgeConfigSecurityAllowedSourcesRequiresPlanApproval"
                }
              }
            },
            "required": [
              "source_agent_id",
              "capabilities"
            ],
            "additionalProperties": false
          }
        }
      },
      "required": [
        "allowed_sources"
      ],
      "additionalProperties": false
    },
    "permissions": {
      "type": "object",
      "properties": {
        "default_response": {
          "type": "string",
          "enum": [
            "reject",
            "once",
            "always"
          ],
          "title": "BridgeConfigPermissionsDefaultResponse"
        },
        "allow_tools": {
          "type": "array",
          "items": {
            "type": "string",
            "minLength": 1,
            "title": "BridgeConfigPermissionsAllowTools"
          }
        },
        "require_plan_approval_for_tools": {
          "type": "array",
          "items": {
            "type": "string",
            "minLength": 1,
            "title": "BridgeConfigPermissionsRequirePlanApprovalForTools"
          }
        }
      },
      "required": [
        "default_response",
        "allow_tools",
        "require_plan_approval_for_tools"
      ],
      "additionalProperties": false
    },
    "projects": {
      "type": "array",
      "items": {
        "type": "object",
        "properties": {
          "id": {
            "type": "string",
            "minLength": 1,
            "title": "BridgeConfigProjectsId"
          },
          "path": {
            "type": "string",
            "minLength": 1,
            "title": "BridgeConfigProjectsPath"
          },
          "capabilities": {
            "type": "array",
            "items": {
              "type": "string",
              "minLength": 1,
              "title": "BridgeConfigProjectsCapabilities"
            }
          }
        },
        "required": [
          "id",
          "path",
          "capabilities"
        ],
        "additionalProperties": false
      }
    },
    "agents": {
      "type": "array",
      "items": {
        "type": "object",
        "properties": {
          "id": {
            "type": "string",
            "minLength": 1,
            "title": "BridgeConfigAgentsId"
          },
          "url": {
            "type": "string",
            "format": "uri",
            "title": "BridgeConfigAgentsUrl"
          },
          "capabilities": {
            "type": "array",
            "items": {
              "type": "string",
              "minLength": 1,
              "title": "BridgeConfigAgentsCapabilities"
            }
          }
        },
        "required": [
          "id",
          "url",
          "capabilities"
        ],
        "additionalProperties": false
      }
    },
    "timeouts": {
      "type": "object",
      "properties": {
        "default_job_seconds": {
          "type": "integer",
          "exclusiveMinimum": 0,
          "maximum": 9007199254740991,
          "title": "BridgeConfigTimeoutsDefaultJobSeconds"
        },
        "callback_retry_attempts": {
          "type": "integer",
          "minimum": 0,
          "maximum": 9007199254740991,
          "title": "BridgeConfigTimeoutsCallbackRetryAttempts"
        }
      },
      "required": [
        "default_job_seconds",
        "callback_retry_attempts"
      ],
      "additionalProperties": false
    },
    "planning": {
      "type": "object",
      "properties": {
        "plan_annotator_enabled": {
          "type": "boolean"
        },
        "require_approval_for": {
          "type": "array",
          "items": {
            "type": "string",
            "minLength": 1,
            "title": "BridgeConfigPlanningRequireApprovalFor"
          }
        }
      },
      "required": [
        "plan_annotator_enabled",
        "require_approval_for"
      ],
      "additionalProperties": false
    }
  },
  "required": [
    "agent_id",
    "bridge",
    "opencode",
    "security",
    "permissions",
    "projects",
    "agents",
    "timeouts",
    "planning"
  ],
  "additionalProperties": false
}
