{
  "agent_id": "test-vps",
  "bridge": {
    "host": "100.64.0.2",
    "port": 8787,
    "public_url": "http://test-vps.tailnet:8787",
    "ingress_mode": "router"
  },
  "opencode": {
    "base_url": "http://127.0.0.1:4096",
    "server_port": 4096,
    "username": "opencode",
    "password_env": "OPENCODE_SERVER_PASSWORD"
  },
  "security": {
    "auth_mode": "bearer-token",
    "allowed_sources": [
      {
        "source_agent_id": "dev-main",
        "capabilities": ["testing", "qa"],
        "requires_plan_approval": ["deployment", "multi-agent-fanout"]
      }
    ]
  },
  "permissions": {
    "default_response": "reject",
    "allow_tools": ["read", "grep", "glob"],
    "require_plan_approval_for_tools": ["bash", "edit", "write"]
  },
  "projects": [
    {
      "id": "app-under-test",
      "path": "/srv/apps/app-under-test",
      "capabilities": ["testing", "qa"]
    }
  ],
  "agents": [
    {
      "id": "dev-main",
      "url": "http://dev-main.tailnet:8787",
      "capabilities": ["development", "orchestration"]
    }
  ],
  "timeouts": {
    "default_job_seconds": 1800,
    "callback_retry_attempts": 3
  },
  "planning": {
    "plan_annotator_enabled": true,
    "require_approval_for": ["deployment", "destructive", "multi-agent-fanout"]
  }
}
